{
  "id": "nextcloud-server",
  "name": "Nextcloud Server",
  "kind": "server",
  "canonicalUrl": "https://github.com/nextcloud/server",
  "summary": "Servidor autoalojado para archivos y colaboración. Puede custodiar bibliotecas propias, pero no se clasifica como catálogo o proveedor de medios.",
  "tags": [
    "self-hosted",
    "files",
    "sync"
  ],
  "platforms": [
    "web",
    "self-hosted"
  ],
  "languages": [],
  "reviewStatus": "needs-review",
  "lastReviewed": "2026-08-20",
  "evidence": [
    "https://github.com/nextcloud/server"
  ],
  "license": "AGPL-3.0"
}
