{
  "id": "mpv",
  "name": "mpv",
  "kind": "client",
  "canonicalUrl": "https://github.com/mpv-player/mpv",
  "summary": "Reproductor multimedia de línea de comandos de código abierto. La ficha se limita al reproductor y no prescribe orígenes, complementos ni catálogos.",
  "tags": [
    "video",
    "audio",
    "player"
  ],
  "platforms": [
    "cross-platform"
  ],
  "languages": [],
  "reviewStatus": "needs-review",
  "lastReviewed": "2026-08-20",
  "evidence": [
    "https://github.com/mpv-player/mpv"
  ]
}
